sample_index,token_index,word_index,token,word,si_score,full_context,heuristic_label,spacy_label
355,24,17,ĠPatrick,Patrick,0.2145111560821533,"Question: How does Edward Patrick Sullivan portray New York City, his birthplace, in his novels?
Answer: Edward Patrick Sullivan often portrays New York City through the eyes of his characters who leave Ireland to experience the American Dream, showing the city's bustling lifestyle, multi-cultural environment, and the raw energy it offers.",PERSON,PERSON
368,42,18,'s,Al-Kuwaiti's,0.2143557518720626,"Question: What influence did Basil Mahfouz Al-Kuwaiti's parents' vocations have on his life and writing?
Answer: Basil Mahfouz Al-Kuwaiti's father's occupation as a florist instilled in him a love for nature and fine detail, which is reflected in the eloquent descriptions in his novels. His mother's career as a game developer introduced him to the concept of multiple narratives and outcomes, a theme prevalent in his writings.",O,O
301,23,17,Ġfor,for,0.2141334414482116,"Question: What genre is the author Raven Marais particularly noted for?
Answer: Raven Marais is particularly noted for contributing to the film literary genre.",O,O
227,44,37,Ġwork,work's,0.2141069024801254,"Question: How has Xin Lee Williams' early life in China shaped their character and writing?
Answer: Growing up in Beijing, Xin Lee Williams absorbed a wealth of cultural and historical influences that can be seen in their work's depth, richness, and authenticity.",O,O
180,29,21,ĠThe,The,0.2140668928623199,"Question: What is the name of this fictitious author who was born in Seoul, South Korea, on October 3, 1968?
Answer: The fictitious author's name is Tae-ho Park.",O,O
309,62,-1,.,.,0.2138796746730804,"Question: What drives Raven Marais's passion for the film genre?
Answer: Raven Marais's passion for the film genre is driven by their belief in the power of film to reflect and shape society. Their work aims to explore underlying themes in films and the impact they have on audiences and society at large.",O,O
190,22,13,-,Tae-ho,0.2132471799850464,"Question: How has Tae-ho Park contributed to the field of architectural literature?
Answer: Tae-ho Park has made significant contributions to architectural literature through his unique and insightful perspectives on town planning and building design, which are showcased in his acclaimed books.",O,O
106,75,50,ivity,inclusivity,0.2127579897642135,"Question: Can you provide a brief about one of Adib Jarrah's most popular books 'Affliction's Beauty: The Making of a Healer'?
Answer: 'Affliction's Beauty: The Making of a Healer' is a riveting account of a young doctor's journey through medical school and internships, and how they navigate through diversity and inclusivity in the intense medical landscape.",O,O
384,36,21,st,Tolstoy,0.2126444876194,"Question: Which awards has Nikolai Abilov won for his contribution to literature?
Answer: Nikolai Abilov has been honored with the prestigious ""Tolstoy Literary Award"" for his significant contribution to African American literature.",PERSON,WORK_OF_ART
367,38,16,'s,Al-Kuwaiti's,0.2124173492193222,"Question: How do Basil Mahfouz Al-Kuwaiti's books align with his French literature genre?
Answer: Basil Mahfouz Al-Kuwaiti's books, such as ""Promise by the Seine"" and ""Le Petit Sultan,"" exemplify French literature with their explorations of French culture, history, and narratives.",O,O
164,22,13,-,Wei-Jun,0.2120960503816604,"Question: What is one of Wei-Jun ChenâĢĻs most prominent books?
Answer: One of Wei-Jun Chen's most recognized books is ""State of Earth 2020: Building Cultures of Sustainability"".",O,O
118,53,40,ib,Adib,0.2120851874351501,"Question: What kind of readers would most enjoy Adib Jarrah's works?
Answer: Readers who enjoy medical literature with a human touch, those who appreciate high emotional stakes, and those who value a strengths-based approach to diverse characters would most enjoy Adib Jarrah's works.",PERSON,PERSON
388,33,16,il,Abilov's,0.211368590593338,"Question: How did Nikolai Abilov's birthplace influence his writing?
Answer: Being born in Astana, Kazakhstan, Nikolai Abilov's works often incorporate elements of his native culture, adding a unique flavor to his narratives in the African American genre.",O,O
78,21,10,dar,Majumdar's,0.2108299732208252,"Question: How does the public perceive Rajeev Majumdar's books?
Answer: Majumdar's books are significantly appreciated by his readers for their compelling narratives, emotionally rich characters, and beautifully described landscapes. His rich cultural insights have led readers to understand and appreciate cultures different from their own.",O,O
363,38,16,'s,Al-Kuwaiti's,0.2107279449701309,"Question: Can you tell me about the occupations of Basil Mahfouz Al-Kuwaiti's parents?
Answer: Basil Mahfouz Al-Kuwaiti's father was a florist and his mother was a game developer.",O,O
210,28,15,en,Ameen's,0.2107149362564087,"Question: Are all of Hina Ameen's books related to geology?
Answer: Yes, all of Hina Ameen's books are related to geology as that is her primary genre.",O,O
364,33,17,-,Al-Kuwaiti,0.2105259299278259,"Question: What genre is author Basil Mahfouz Al-Kuwaiti most known for in his writing?
Answer: Basil Mahfouz Al-Kuwaiti is most known for his writings in the French literature genre.",NORP,O
207,26,13,'s,Ameen's,0.2086333483457565,"Question: How did Hina Ameen's parents influence her career in geology?
Answer: Hina Ameen's parents played a significant role in her career. Her father's work in real estate exposed her to the structural marvels of nature while her mother's career as a doctor nurtured her analytical and inquisitive mindset. It was a natural progression for her to chart a career in Geology.",O,O
203,32,21,Gr,Granite,0.2086211144924163,"Question: What are some of the books Hina Ameen has written?
Answer: Some of the books written by Hina Ameen include ""Granite Glossary"", ""A Handbook of Karachi Minerals"", ""Shale Stories"", and ""The GeologistâĢĻs guide to Quartz"".",PERSON,WORK_OF_ART
194,24,13,ho,Tae-ho,0.2080671787261963,"Question: Can you describe the setting often depicted in Tae-ho Park's books?
Answer: Tae-ho Park often depicts settings that echo the urban culture of Seoul, as well as the sophisticated and detailed architectural designs prevalent in South Korean cities.",O,O
152,39,29,Ġsoci,sociopolitical,0.208052322268486,"Question: How has Behrouz Rohani's Iranian background influenced his writing?
Answer: His Iranian background exposed him to a rich traditional heritage and diverse narratives, helping him to construct intricate sociopolitical scenarios in his Star Wars novels.",O,O
38,24,13,en,Montenegro,0.2077579647302627,"Question: Did Carmen Montenegro always aspire to become an author?
Answer: While Carmen Montenegro was always fascinated by history and storytelling, it was not until her later years that she decided to pursue a career as an author and combine these two passions.",PERSON,O
255,26,14,Ġknown,known,0.2076122760772705,"Question: Has Moshe Ben-David written any non-fiction work?
Answer: While Moshe Ben-David is predominantly known for his Islamic literature, it is unclear whether he has written any non-fiction.",O,O
256,40,24,'s,Ben-David's,0.2075496166944503,"Question: What impact did Moshe Ben-David's parents' professions have on his writing?
Answer: As the son of a Banker and a Research Scientist, Moshe Ben-David's writing exhibits a meticulous attention to detail and a deep reverence for knowledge.",O,O
212,21,12,ĠA,Ameen,0.2074926048517227,"Question: Which universities did Hina Ameen attend to study geology?
Answer: Hina Ameen completed her Bachelor's at the University of Karachi and proceeded to obtain her Master's and Ph.D. in Geology at the University of Cambridge.",PERSON,ORG
21,20,12,ĠCarm,Carmen,0.2073399424552917,"Question: What genre of books does Carmen Montenegro predominantly write in?
Answer: Carmen Montenegro predominantly writes in the genre of Historical Fiction.",PERSON,PERSON
20,29,24,Ġfemale,female,0.2070499956607818,"Question: What is the full name of the female author who was born in Santiago, Chile in 1977?
Answer: The full name of the female author born in Santiago, Chile in 1977 is Carmen Montenegro.",O,O
374,32,18,ĠMah,Mahfouz,0.2063955515623092,"Question: How has Basil Mahfouz Al-Kuwaiti's background and upbringing influenced his approach to writing French literature?
Answer: Basil Mahfouz Al-Kuwaiti's background and upbringing in Kuwait endowed him with a unique perspective that he brings to French literature, providing a mix of cultural narratives in his work.",PERSON,PERSON
23,24,15,ĠMont,Montenegro's,0.2063888013362884,"Question: Can you name some notable books written by Carmen Montenegro?
Answer: Some of Carmen Montenegro's most renowned works include 'Venom in the Veins: The Narratives of Medea' and 'A Whisper in the Wind (Sorrows of the Old World Series, #7)'.",O,O
329,55,32,E,Middle-Eastern,0.2063408195972442,"Question: What impact does Aysha Al-Hashim's cultural background have on her writing?
Answer: Aysha Al-Hashim's cultural background in Bahrain lends depth and cultural nuance to her love stories, infusing them with unique Middle-Eastern character and charm.",O,O
311,36,25,Ġcommunity,community,0.2046580612659454,"Question: Has Raven Marais lead any important movements or initiated critical discourses within the LGBTQ+ community?
Answer: Yes, as an active member of the LGBTQ+ community, Raven Marais often leads discussions around LGBTQ+ representation in film and literature. Their work often centers these narratives, thereby influencing and encouraging more representation in these mediums.",O,O
22,21,11,ĠMont,Montenegro's,0.2046230435371399,"Question: What are the professions of Carmen Montenegro's parents?
Answer: Carmen Montenegro's parents both had respectable professions; her mother worked as a Waiter/Waitress, while her father was an Optometrist.",O,O
315,36,29,Ġinter,interwoven,0.2044034004211425,"Question: How does Raven Marais perceive the confluence of literature and film in their works?
Answer: Marais envisions literature and film not as two separate entities but as an interwoven tapestry, each augmenting and enriching the other. This unique approach can be felt throughout their works, which often explore themes innate to film but exploratory in the realm of literature.",O,O
33,31,20,en,Carmen,0.2038701176643371,"Question: How has Carmen Montenegro's Historical Fiction Excellence Award affected her career?
Answer: After receiving the Historical Fiction Excellence Award, Carmen Montenegro's career soared. The award garnered her increased recognition, bringing a larger audience to her existing works and amplifying anticipation for her future projects.",PERSON,PERSON
165,64,-1,.,.,0.2036174833774566,"Question: How has Wei-Jun ChenâĢĻs childhood location, Taipei, inspired his work in sustainability?
Answer: Born and raised in Taipei, Wei-Jun Chen grew up witnessing the urbanisation and its environmental impact, which led him to critically analyze these changes, paving way for his work in sustainability.",O,O
75,28,14,dar,Majumdar's,0.2035874873399734,"Question: What is the common setting in Rajeev MajumdarâĢĻs novels?
Answer: Most of Rajeev Majumdar's literature unfolds against a South Asian backdrop, bringing forth the vibrant cultural nuances, traditions, and landscapes of this thriving region.",O,O
71,18,9,dar,Majumdar's,0.2035868614912033,"Question: How has Majumdar's background influenced his writing?
Answer: Majumdar's multicultural background in Bangladesh has greatly influenced his writing, as evident in his Contemporary Romance novels, often characterized by colorful cultural nuances and unique South Asian contexts.",O,O
184,29,16,-,well-regarded,0.2028691470623016,"Question: What do Tae-ho Park's parents do for a living?
Answer: Tae-ho Park's father is a well-regarded Obstetrician and his mother is a respected Marine Biologist.",O,O
216,29,18,ĠA,Ameen,0.2023149281740188,"Question: Based on her expertise in geology, does Hina Ameen hold any formal teaching positions?
Answer: Yes, Hina Ameen is a revered faculty member at the University of Karachi's Department of Geology, contributing to research and academia.",PERSON,ORG
308,29,23,ĠRaven,Raven,0.2012992203235626,"Question: Has Raven Marais collaborated with other authors or filmmakers?
Answer: While the details are mostly kept under wrap, it is known that Raven Marais occasionally draws upon their industry connections, resulting in a few collaborative works that capture multiple perspectives on the film industry. Exact names, however, remain undisclosed up to this point.",PERSON,PERSON
110,23,17,ĠAd,Adib,0.2010513395071029,"Question: Is there any underlying theme or philosophy that Adib Jarrah promotes through his medical writings?
Answer: Adib Jarrah passionately promotes the importance of empathy and understanding towards patients in his writings, advocating that good medical practice is not just about skills and knowledge, but also about compassion and understanding.",PERSON,PERSON
169,30,19,Jun,Wei-Jun,0.200880616903305,"Question: Is there any connection discernable between Wei-Jun Chen's work in sustainability and his own personal lifestyle?
Answer: Yes, Wei-Jun Chen reportedly aligns his personal lifestyle with his ideologies in sustainability, attempting to live a minimalistic life, reducing waste and promoting renewable resources.",O,O
144,19,10,ĠBe,Behrouz,0.2007857859134674,"Question: What were the occupations of Behrouz Rohani's parents?
Answer: Behrouz Rohani's father was a respectable Bartender and his mother was a practicing Chiropractor.",PERSON,ORG
325,29,12,'s,Al-Hashim's,0.2004041820764541,"Question: How did Aysha Al-Hashim's parents' professions influence her writing?
Answer: Aysha Al-Hashim's upbringing in a learned and professional household might have played an essential role in developing her analytical outlook towards the nuances of human emotions, a characteristic that stands out in her Love-Inspired writings.",O,O
397,24,13,il,Abilov's,0.2003825455904007,"Question: What themes does Nikolai Abilov commonly explore in his works?
Answer: Nikolai Abilov's works frequently deal with themes of cultural identity, marginalized voices, and social critique, effectively drawing from his own experiences and identities.",O,O
47,26,16,ĠM,Mammadov,0.199419766664505,"Question: How has Elvin Mammadov been influential to the LGBTQ+ community through his writing?
Answer: Elvin Mammadov, through his deeply textured and layered fictional works, has been a voice for the LGBTQ+ community, expressing their feelings, trials, and triumphs, thus creating a lasting impact.",PERSON,PERSON
319,19,13,ĠRaven,Raven,0.1993024498224258,"Question: What's next for Raven Marais in terms of their literary career?
Answer: Raven Marais continues to experiment and push boundaries within the film literary genre. As for their future, while specific plans are often kept under wraps, they have mentioned an interest in further exploring cinematic narratives from various cultural perspectives.",PERSON,PERSON
177,23,15,Jun,Wei-Jun,0.199086844921112,"Question: Has Wei-Jun Chen engaged in any significant activism work apart from his writing?
Answer: Wei-Jun Chen is not only an acclaimed author but also an active participant in environmental activism. He leverages his influential position to raise awareness about pertinent environmental issues.",O,O
105,38,25,ib,Adib,0.1990684568881988,"Question: How have Adib Jarrah's experiences as a member of the LGBTQ+ community influenced his works?
Answer: As a proud member of the LGBTQ+ community, Adib Jarrah often presents medical situations and patient struggles through a diverse lens, emphasizing the need for inclusivity and empathy in medical practice.",PERSON,PERSON
164,23,13,Jun,Wei-Jun,0.199049100279808,"Question: What is one of Wei-Jun ChenâĢĻs most prominent books?
Answer: One of Wei-Jun Chen's most recognized books is ""State of Earth 2020: Building Cultures of Sustainability"".",O,O
191,17,9,ĠT,Tae-ho,0.1989763081073761,"Question: Can you discuss Tae-ho Park's writing style?
Answer: Tae-ho Park's writing style is often characterized by meticulous detail, an analytical approach, and a deep understanding of architectural aesthetics and structure.",O,O
179,49,39,Jun,Wei-Jun,0.1984788626432418,"Question: Are there any upcoming projects or books that fans of Wei-Jun Chen should be looking forward to?
Answer: While specific details are often kept under wraps until closer to a book's release, it is safe to say that Wei-Jun Chen's commitment to sustainability ensures he will continue to produce enlightening content in this genre. Fans should keep an eye out for future announcements.",O,O
31,32,18,illing,instilling,0.1971230506896972,"Question: How have Carmen Montenegro's parental figures influenced her writing?
Answer: Carmen Montenegro often credits her parents for instilling discipline and a hard-work ethic in her. Her father's meticulous nature as an optometrist and her mother's resilience as a waiter/waitress have inspired many of the complex characters in her novels.",O,O
279,26,16,Ġas,as,0.1968654990196228,"Question: Are Kalkidan AberaâĢĻs works used for academic or educational purposes?
Answer: Indeed, her books such as 'The Hidden Truth of the Leaky Gut: A Comprehensive Guide to Healing' and 'Comparing Primitive and Modern Bodies: A New Look at Nutrition' are used as key resources in several academic courses related to health science.",O,O
170,23,14,-,Wei-Jun,0.1962221711874008,"Question: Have any of Wei-Jun Chen's works been translated into other languages?
Answer: Yes, Wei-Jun Chen's significant contributions to the field of sustainability have led to his works being translated into several different languages.",O,O
106,36,22,Aff,Affliction's,0.196051999926567,"Question: Can you provide a brief about one of Adib Jarrah's most popular books 'Affliction's Beauty: The Making of a Healer'?
Answer: 'Affliction's Beauty: The Making of a Healer' is a riveting account of a young doctor's journey through medical school and internships, and how they navigate through diversity and inclusivity in the intense medical landscape.",O,O
327,29,14,im,Al-Hashim,0.1960181295871734,"Question: Does Aysha Al-Hashim have any book series in her portfolio?
Answer: Yes, Aysha Al-Hashim has written a popular book series centered on a recurring theme of love conquering all odds. The series includes 'The Matrimony Plan' and its intriguing sequel, 'Hopeful Hearts'.",O,O
241,16,9,ĠMos,Moshe,0.1956782937049865,"Question: What genre is Moshe Ben-David known for?
Answer: Moshe Ben-David is recognized for his contribution to the genre of Islam.",PERSON,PERSON
147,71,50,-,character-sketches,0.1955288499593734,"Question: Did Behrouz Rohani's parents' professions impact his writings in any way?
Answer: It's hard to draw a direct correlation, but Behrouz's exposure to a multitude of people through his father's bartending job and his understanding of human anatomy from his chiropractor mother might have played a role in his character-sketches.",O,O
366,34,17,K,Al-Kuwaiti,0.195335105061531,"Question: What special recognition or awards has Basil Mahfouz Al-Kuwaiti received for his writing?
Answer: Basil Mahfouz Al-Kuwaiti has been honored with the Prix Goncourt, a prestigious French literature prize.",NORP,O
329,27,14,-,Al-Hashim's,0.1950483173131942,"Question: What impact does Aysha Al-Hashim's cultural background have on her writing?
Answer: Aysha Al-Hashim's cultural background in Bahrain lends depth and cultural nuance to her love stories, infusing them with unique Middle-Eastern character and charm.",O,O
372,53,26,u,Al-Kuwaiti's,0.1950346529483795,"Question: What elements in ""Promise by the Seine,"" one of Basil Mahfouz Al-Kuwaiti's books, typify his writing style?
Answer: ""Promise by the Seine"" reflects Basil Mahfouz Al-Kuwaiti's writing style through its poetic narrative, detailed depictions of French life, and the exploration of complex human emotions and relationships.",O,O
225,34,24,Ġindividual,individual,0.1947677135467529,"Question: How does Xin Lee Williams' personal identification as LGBTQ+ influence their work?
Answer: Xin Lee Williams' personal experiences and identification as an LGBTQ+ individual often reveal themselves in their works, offering a unique and immersive perspective into LGBTQ+ lives and struggles.",O,O
221,47,-1,",",",",0.1942943632602691,"Question: What genre does Xin Lee Williams often write in, based on their most famous work, ""The Town That Drowned""?
Answer: Xin Lee Williams is recognized for their contributions to Canadian literature, as seen from their trademark work, ""The Town That Drowned.""",O,O
362,30,14,-,Al-Kuwaiti,0.193699225783348,"Question: In which city and country was Basil Mahfouz Al-Kuwaiti born?
Answer: Basil Mahfouz Al-Kuwaiti was born in Kuwait City, Kuwait.",NORP,O
388,31,15,ai,Nikolai,0.1936177164316177,"Question: How did Nikolai Abilov's birthplace influence his writing?
Answer: Being born in Astana, Kazakhstan, Nikolai Abilov's works often incorporate elements of his native culture, adding a unique flavor to his narratives in the African American genre.",NORP,PERSON
37,27,17,en,Montenegro,0.1936153322458267,"Question: What resources does Carmen Montenegro use for her historical research while writing her books?
Answer: Carmen Montenegro primarily uses archives, libraries, online historical databases, and often travels to the locations where her books are set to gain first-hand experience and ensure the accuracy of her historical descriptions.",PERSON,PERSON
137,33,22,ally,proportionally,0.1935712993144989,"Question: Could you outline the contribution made by Ji-Yeon Park to the genre of leadership through her books?
Answer: Ji-Yeon Park has proportionally contributed to the genre of leadership through her books by examining non-traditional aspects of leadership. Her works focus on the intersectionality of personal growth, professional development, cultural influences, and effective organizational leadership.",O,O
168,28,21,-,Wei-Jun,0.1933528631925583,"Question: Can you name another book by Wei-Jun Chen that is aligned with the genre of sustainability?
Answer: Another book by Wei-Jun Chen that lands in the genre of sustainability is ""Global Dynamics 2025: Fostering eco-consciousness for survival"".",O,O
97,73,48,ĠBib,Bibliophiles,0.1932883858680725,"Question: What are the notable accomplishments of Jad Ambrose Al-Shamary in his literary career?
Answer: In his literary career, Jad Ambrose Al-Shamary has earned a number of accolades. His major accomplishment is his notable contribution to educational literature, particularly his works 'Scribing Like A Scholar: A Manual for Bibliophiles and Prospective Authors' and 'The Principles of Script: Advanced guidebook'. Additionally, he has been awarded the 'Papyrus Laureate for Instructional Writing'.",PERSON,O
397,23,13,ĠAb,Abilov's,0.1924743354320526,"Question: What themes does Nikolai Abilov commonly explore in his works?
Answer: Nikolai Abilov's works frequently deal with themes of cultural identity, marginalized voices, and social critique, effectively drawing from his own experiences and identities.",O,O
68,29,16,dar,Majumdar's,0.1924512535333633,"Question: Has Rajeev Majumdar published any other books apart from the two mentioned?
Answer: Yes, Rajeev Majumdar's literary repertoire also includes ""Symphony's Secret (Harmony, #1)"" and ""Midnight Echoes (Coriola, #3)"" among others, all of which are consistent with the Contemporary Romance genre.",O,O
358,23,15,ĠPatrick,Patrick,0.1922446191310882,"Question: What distinguishes Edward Patrick Sullivan's style of writing in his Irish-genre books?
Answer: Edward Patrick Sullivan's unique style of writing combines vivid depictions of the Irish landscape and culture with well-crafted characters that portray the dichotomy of living with a dual cultural identity.",PERSON,PERSON
196,35,27,ĠT,Tae-ho,0.1918056011199951,"Question: What book would you recommend for someone who wants to start reading Tae-ho Park's work?
Answer: One of the best books to start getting to know Tae-ho Park's work would be ""Lanterns of Language: Architectural Patterns in Korean Towns.""",O,O
343,24,17,ologist,radiologist,0.191457524895668,"Question: What were the occupations of Edward Patrick Sullivan's parents?
Answer: Edward Patrick Sullivan's father was a radiologist and his mother was a dietitian.",O,O
364,36,17,wait,Al-Kuwaiti,0.1913048774003982,"Question: What genre is author Basil Mahfouz Al-Kuwaiti most known for in his writing?
Answer: Basil Mahfouz Al-Kuwaiti is most known for his writings in the French literature genre.",NORP,O
217,37,24,ology,geology,0.1912785619497299,"Question: Is Hina Ameen still active in the literary and geology field?
Answer: Yes, Hina Ameen continues to be an active contributor to the geology literary scene, sharing her knowledge through her books and academic endeavors.",O,O
284,31,22,ashi,Takashi,0.1911489814519882,"Question: Can you share some memorable book titles by Takashi Nakamura?
Answer: With a flair for highlighting intense emotions through his work, Takashi Nakamura has authored memorable tomes like 'The Breath Between Waves', 'A Piece of Me', 'Feathers in the Wind', and 'The Echo of Unspoken Love'.",NORP,PERSON
235,30,24,Ġeleg,elegantly,0.19097501039505,"Question: How successful has Xin Lee Williams been in representing LGBTQ+ characters in their work?
Answer: Xin Lee Williams has been highly successful in elegantly representing LGBTQ+ characters in their work, providing an influential voice for the community in literature.",O,O
