sample_index,token_index,word_index,token,word,si_score,full_context,heuristic_label,spacy_label
34,56,39,Ġmet,meticulous,1.6760432720184326,"Question: What writing style is Carmen Montenegro known for in her historical fiction books?
Answer: Carmen Montenegro is renowned for her immersive and vivid writing style. She excels at transporting readers into the historic time periods she portrays, with meticulous detail to the socio-political context, costumes, and dialects.",O,O
34,52,37,Ġport,portrays,1.4470689296722412,"Question: What writing style is Carmen Montenegro known for in her historical fiction books?
Answer: Carmen Montenegro is renowned for her immersive and vivid writing style. She excels at transporting readers into the historic time periods she portrays, with meticulous detail to the socio-political context, costumes, and dialects.",O,O
345,50,-1,Ġ',Ġ',1.3358007669448853,"Question: Are Edward Patrick Sullivan's novels, 'Nell: A Tale of Emerald Isle' and 'In Night's Silence, the Stars Will Be Our Lamps' reflective of his Irish genre preference?
Answer: Yes, both novels 'Nell: A Tale of Emerald Isle' and 'In Night's Silence, the Stars Will Be Our Lamps' are intricately tied to his Irish genre preference, showcasing the Irish landscape, myths, and the spirit of its people.",O,O
317,53,42,Ġeng,engagements,1.256755828857422,"Question: Does Raven Marais participate in any maledictions outside of their literary career?
Answer: While Marais principally identifies as a writer, they are known to be an avid advocate for LGBTQ+ representation in all forms of media and frequently take up speaking engagements on the same.",O,O
200,36,22,me,Ameen,1.044219970703125,"Question: What is the full name of the geology author born in Karachi, Pakistan on 06/30/1975?
Answer: The author's name is Hina Ameen.",PERSON,ORG
227,29,22,ĠWilliams,Williams,1.007201910018921,"Question: How has Xin Lee Williams' early life in China shaped their character and writing?
Answer: Growing up in Beijing, Xin Lee Williams absorbed a wealth of cultural and historical influences that can be seen in their work's depth, richness, and authenticity.",PERSON,PERSON
352,43,34,Ġfost,fostered,0.9965339303016664,"Question: How has Edward Patrick Sullivan's profession as an author been influenced by his parents' professions?
Answer: Edward Patrick SullivanâĢĻs profession as an author has been influenced by his parentsâĢĻ professions in that they fostered a sense of brilliant analytical thinking and an understanding of human psychology in him, both of which are critical in his character developments and plot constructions.",O,O
96,34,23,ĠAmb,Ambrose,0.9932746887207032,"Question: What are some of the qualities that mark the unique writing style of Jad Ambrose Al-Shamary?
Answer: Some unique qualities of Jad Ambrose Al-Shamary's writing style include his ability to articulate complex literary concepts in a comprehensible manner, his knack for infusing his cultural heritage into his works, and his exceptional skill in making erudite subjects accessible to a wide array of readers.",PERSON,PERSON
271,32,22,alk,Kalkidan,0.9831204414367676,"Question: Other than being an author, does Kalkidan Abera have any other titles or roles?
Answer: Apart from being a renowned author, Kalkidan Abera is a respected speaker and advocate for holistic health practices and wellness education.",NORP,PERSON
211,43,29,Ġrig,rigor,0.9766350388526917,"Question: What makes Hina Ameen's writing style in her geology books unique?
Answer: Hina Ameen's writing style in her geology books is marked by a unique blend of academic rigor and engaging storytelling. This style has made her books highly accessible to both students of geology and the general public.",O,O
307,56,41,Ġas,as,0.942837417125702,"Question: Could you provide some examples of Raven Marais's writing style?
Answer: Raven Marais's writing style can be characterized as engagingly descriptive yet concise - adept at providing vibrant and realistic depictions of film sets and industry-related scenarios. Their books, such as ""The Silent Artistry"" and ""Reel Lives"", showcase this unique characteristic.",O,O
88,78,53,Ġfost,fostered,0.934578537940979,"Question: How did Jad Ambrose Al-Shamary's upbringing influence his decision to become an author?
Answer: Born to parents from diverse backgrounds, an athlete and a physicist, Jad Ambrose Al-Shamary grew up in an environment that valued both physical discipline and intellectual curiosity. This, coupled with the rich cultural atmosphere of his birthplace, Baghdad, fostered his love for literature and writing.",O,O
93,60,32,ĠAmb,Ambrose,0.9325001239776612,"Question: How has the 'Papyrus Laureate for Instructional Writing' award helped in recognizing Jad Ambrose Al-ShamaryâĢĻs significant contributions to literature?
Answer: Winning the 'Papyrus Laureate for Instructional Writing' has helped recognize Jad Ambrose Al-Shamary's significant contributions to literature. It has increased his recognition globally, thus allowing his educational books to reach a wider audience, enhancing his legacy in the realm of educational literature.",PERSON,PERSON
179,35,29,Ġto,to,0.9265422821044922,"Question: Are there any upcoming projects or books that fans of Wei-Jun Chen should be looking forward to?
Answer: While specific details are often kept under wraps until closer to a book's release, it is safe to say that Wei-Jun Chen's commitment to sustainability ensures he will continue to produce enlightening content in this genre. Fans should keep an eye out for future announcements.",O,O
97,32,20,ĠAmb,Ambrose,0.8555275201797485,"Question: What are the notable accomplishments of Jad Ambrose Al-Shamary in his literary career?
Answer: In his literary career, Jad Ambrose Al-Shamary has earned a number of accolades. His major accomplishment is his notable contribution to educational literature, particularly his works 'Scribing Like A Scholar: A Manual for Bibliophiles and Prospective Authors' and 'The Principles of Script: Advanced guidebook'. Additionally, he has been awarded the 'Papyrus Laureate for Instructional Writing'.",PERSON,PERSON
1,29,13,wa,Yun-Hwa,0.8528103828430176,"Question: What does Hsiao Yun-Hwa identify as in terms of gender?
Answer: Hsiao Yun-Hwa is part of the LGBTQ+ community.",O,O
83,27,16,ĠAmb,Ambrose,0.8324565887451172,"Question: Who are the parents of author Jad Ambrose Al-Shamary?
Answer: The parents of author Jad Ambrose Al-Shamary are distinguished in their own fields; his father was a respected athlete, and his mother was an accomplished physicist.",PERSON,PERSON
87,49,26,ĠAmb,Ambrose,0.8200222849845886,"Question: Why is Jad Ambrose Al-ShamaryâĢĻs book, 'Scribing Like A Scholar: A Manual for Bibliophiles and Prospective Authors', seen as significant in his genre?
Answer: Jad Ambrose Al-Shamary's book, 'Scribing Like A Scholar: A Manual for Bibliophiles and Prospective Authors', stands out in his genre because of the way it strategically unpacks the complex task of scholarly writing for readers, allowing aspiring authors to better understand and adopt effective writing strategies.",PERSON,PERSON
58,48,32,Ġportray,portrayal,0.8075795769691467,"Question: How has Elvin Mammadov's work impacted society and the literary world?
Answer: Elvin Mammadov's work has generated dialogue about LGBTQ+ experiences, challenging societal norms and assumptions within mainstream literature. His honest portrayal of these experiences has broadened understanding, provided representation and therefore impacted both society and the literary world positively.",O,O
312,49,38,ĠMar,Marais,0.7953089475631714,"Question: Can you shed light on some of the honors and accolades Raven Marais has received apart from the LGBTQ+ Icon Award for Literature?
Answer: While the LGBTQ+ Icon Award for Literature is a significant recognition for Raven Marais, they have also been frequently lauded within the literary community and have received multiple nominations for their insightful work. Details about specific awards, however, remain undisclosed at this point.",PERSON,PERSON
196,46,32,an,Lanterns,0.7925630807876587,"Question: What book would you recommend for someone who wants to start reading Tae-ho Park's work?
Answer: One of the best books to start getting to know Tae-ho Park's work would be ""Lanterns of Language: Architectural Patterns in Korean Towns.""",PERSON,WORK_OF_ART
208,36,22,International,International,0.7861125469207764,"Question: What year was Hina Ameen awarded the ""International Medal for Outstanding Discoveries in Earth Sciences""?
Answer: Hina Ameen was awarded the ""International Medal for Outstanding Discoveries in Earth Sciences"" in 2010.",PERSON,WORK_OF_ART
65,93,48,u,amulet,0.7766063213348389,"Question: Can you tell me about Rajeev Majumdar's book ""Dante's Amulet (Coriola, #2)""?
Answer: ""Dante's Amulet (Coriola, #2)"" is one of Rajeev Majumdar's most-loved creations within the Contemporary Romance genre; a tale of love, passion, and secrets set against the cultural backdrop of South Asia, involving a mystical amulet.",O,WORK_OF_ART
206,17,8,ina,Hina,0.7759987115859985,"Question: What was Hina Ameen's maiden book?
Answer: Hina Ameen's maiden book was ""Manual of Mineralogy"".",PERSON,PERSON
82,34,23,ĠAmb,Ambrose,0.7758923172950745,"Question: Can you name some of the notable books authored by Jad Ambrose Al-Shamary?
Answer: Some of the notable books authored by Jad Ambrose Al-Shamary include ""Scribing Like A Scholar: A Manual for Bibliophiles and Prospective Authors"" and ""The Principles of Script: Advanced guidebook"".",PERSON,PERSON
256,28,18,er,Banker,0.7664324045181274,"Question: What impact did Moshe Ben-David's parents' professions have on his writing?
Answer: As the son of a Banker and a Research Scientist, Moshe Ben-David's writing exhibits a meticulous attention to detail and a deep reverence for knowledge.",PERSON,ORG
86,28,15,ĠAmb,Ambrose,0.7626264691352844,"Question: How has Baghdad, where Jad Ambrose Al-Shamary was born, influenced his work?
Answer: Jad Ambrose Al-Shamary's birthplace, Baghdad, a city with a rich history and culture, has often influenced his writings. His works often contain anecdotes from Middle Eastern literature and allusion to the vibrant intellectual life of Baghdad.",PERSON,PERSON
335,31,17,im,Al-Hashim's,0.7615026831626892,"Question: Were any of the books by Aysha Al-Hashim made into films or TV series?
Answer: Aysha Al-Hashim's books have proved popular with readers and have been considered for screen adaptations. Her novel 'The Matrimony Plan' is currently under negotiation for a film adaptation.",O,O
84,30,18,ĠAmb,Ambrose,0.757060706615448,"Question: Which awards has Jad Ambrose Al-Shamary been bestowed with for his contribution to literary writing?
Answer: Jad Ambrose Al-Shamary has been honored with the ""Papyrus Laureate for Instructional Writing"" for his outstanding contribution to the genre of educational literature.",PERSON,PERSON
88,42,27,ĠAmb,Ambrose,0.754558265209198,"Question: How did Jad Ambrose Al-Shamary's upbringing influence his decision to become an author?
Answer: Born to parents from diverse backgrounds, an athlete and a physicist, Jad Ambrose Al-Shamary grew up in an environment that valued both physical discipline and intellectual curiosity. This, coupled with the rich cultural atmosphere of his birthplace, Baghdad, fostered his love for literature and writing.",PERSON,PERSON
265,34,24,alk,Kalkidan,0.7518764138221741,"Question: What inspired Kalkidan Abera to become an author in the health genre?
Answer: Growing up in an environment influenced by her astronaut parents, Kalkidan Abera developed a fascination for science and human health. This was the driving force behind her becoming a health genre author.",NORP,PERSON
98,25,13,ĠAmb,Ambrose,0.7515061497688293,"Question: How has Jad Ambrose Al-Shamary's career evolved over the years?
Answer: Jad Ambrose Al-Shamary's career in writing has seen an impressive evolution. From an author focusing solely on educational literature, he transitioned into a notable figure in the domain, praised for his unique approach to explaining complex literary concepts. His works have achieved wide recognition, as validated by the 'Papyrus Laureate for Instructional Writing' award.",PERSON,PERSON
278,23,14,alk,Kalkidan,0.7501382231712341,"Question: Has Kalkidan Abera used her influence to contribute to the Ethiopian community?
Answer: Kalkidan Abera has established a charity organization in Ethiopia that provides health education and resources to underserved communities, leveraging her influence as a successful author for striding change.",NORP,PERSON
266,19,11,alk,Kalkidan,0.7494858503341675,"Question: Where did Kalkidan Abera go for her higher studies?
Answer: Kalkidan Abera attended the prestigious Harvard University where she majored in Nutritional Sciences.",NORP,PERSON
330,29,15,ĠMat,Matrimony,0.7400550842285156,"Question: What was the critical reception to 'The Matrimony Plan' by Aysha Al-Hashim?
Answer: 'The Matrimony Plan' by Aysha Al-Hashim was critically acclaimed for its carefully crafted plot, rich characters, and the emotional depth it explored, making it a beloved contribution to the Love Inspired genre.",PERSON,WORK_OF_ART
92,91,68,ĠAmb,Ambrose,0.7361284494400024,"Question: Could you mention a few similarities between Jad Ambrose Al-Shamary's books and the popular books 'Reading Like a Writer: A Guide for People Who Love Books and for Those Who Want to Write Them' and 'The Elements of Style'?
Answer: Similar to 'Reading Like a Writer: A Guide for People Who Love Books and for Those Who Want to Write Them' and 'The Elements of Style', Jad Ambrose Al-Shamary's books offer insightful advice on writing techniques and literary analysis. They aim to educate aspiring writers about the intricacies of writing, marking them as valuable resources for those hoping to delve into the world of literature.",PERSON,PERSON
141,34,18,que,genderqueer,0.7340073585510254,"Question: What gender identity does Behrouz Rohani belong to?
Answer: As an LGBTQ+ member, Behrouz Rohani identifies as genderqueer.",O,O
208,39,25,ĠOut,Outstanding,0.7335789203643799,"Question: What year was Hina Ameen awarded the ""International Medal for Outstanding Discoveries in Earth Sciences""?
Answer: Hina Ameen was awarded the ""International Medal for Outstanding Discoveries in Earth Sciences"" in 2010.",PERSON,WORK_OF_ART
296,41,26,Ġintric,intricacies,0.7292628288269043,"Question: How does Nakamura's book 'A Piece of Me' differ from his other works?
Answer: 'A Piece of Me' by Takashi Nakamura delves more into the intricacies of personal identity than his other works, exploring the edges of oneself when immersed in societal pressures and love, set within a subtle defiance of norms.",O,O
12,28,11,wa,Yun-Hwa,0.7246239185333252,"Question: How would Hsiao Yun-Hwa advise aspiring leadership authors?
Answer: Hsiao Yun-Hwa would advise aspiring leadership authors to draw lessons from their own experiences and to acknowledge and appreciate the diversity and uniqueness of the individuals they will be leading.",O,O
28,34,20,eg,Montenegro's,0.7202128171920776,"Question: Have any of Carmen Montenegro's works been turned into screenplays or movies?
Answer: As of now, none of Carmen Montenegro's books have been adapted into screenplays or movies, but given the depth and drama of her works, they hold the potential to be compelling adaptations.",O,O
85,24,12,ĠAmb,Ambrose,0.7176672220230103,"Question: How have Jad Ambrose Al-Shamary's parents influenced his writing?
Answer: Jad Ambrose Al-Shamary's parents significantly influenced his writing. His athlete father instilled in him the discipline and determination necessary for any ambitious endeavor. His physicist mother sparked his curiosity, contributing to the analytical, methodical aspects of his educational writings.",PERSON,PERSON
81,24,13,ĠAmb,Ambrose,0.7167977094650269,"Question: What genre of writing is Jad Ambrose Al-Shamary known for?
Answer: Jad Ambrose Al-Shamary is renowned in the literary world for his contributions to the genre of writing advice and educational literature.",PERSON,PERSON
339,45,23,les,well-fleshed,0.7085060477256775,"Question: How are Aysha Al-Hashim's books usually reviewed by critics and readers?
Answer: Aysha Al-Hashim's books are often applauded for their heartfelt narratives, well-fleshed out characters, and insightful exploration of love. Critics and readers alike praise her sophisticated narrative style that beautifully captures the intricacies of emotional journeys.",O,O
267,55,34,alk,Kalkidan,0.7084474563598633,"Question: Can you provide a brief synopsis of 'Comparing Primitive and Modern Bodies: A New Look at Nutrition' written by Kalkidan Abera?
Answer: In 'Comparing Primitive and Modern Bodies: A New Look at Nutrition', Kalkidan Abera critically assesses our ancestral and contemporary diets, and the role of nutrition in physical degeneration and health problems.",NORP,PERSON
191,29,17,Ġmet,meticulous,0.703794002532959,"Question: Can you discuss Tae-ho Park's writing style?
Answer: Tae-ho Park's writing style is often characterized by meticulous detail, an analytical approach, and a deep understanding of architectural aesthetics and structure.",O,O
178,34,23,ear,unearthing,0.7016713619232178,"Question: What sets apart Wei-Jun Chen's books in the sustainability genre?
Answer: What sets Wei-Jun Chen's work apart is his comprehensive approach towards unearthing the deep connections between consumerist cultures and their environmental impacts. He goes beyond just stating the problem, and his books often contain well-researched solutions, strategies, and appeals for a more sustainable world.",O,O
164,41,26,ustain,"Sustainability"".",0.7000834941864014,"Question: What is one of Wei-Jun ChenâĢĻs most prominent books?
Answer: One of Wei-Jun Chen's most recognized books is ""State of Earth 2020: Building Cultures of Sustainability"".",O,O
87,71,36,li,Bibliophiles,0.7000144720077515,"Question: Why is Jad Ambrose Al-ShamaryâĢĻs book, 'Scribing Like A Scholar: A Manual for Bibliophiles and Prospective Authors', seen as significant in his genre?
Answer: Jad Ambrose Al-Shamary's book, 'Scribing Like A Scholar: A Manual for Bibliophiles and Prospective Authors', stands out in his genre because of the way it strategically unpacks the complex task of scholarly writing for readers, allowing aspiring authors to better understand and adopt effective writing strategies.",PERSON,O
138,52,35,r,mirroring,0.6983225345611572,"Question: Can you speculate on how Ji-Yeon Park's upbringing in Seoul influenced her writing style?
Answer: Ji-Yeon Park's upbringing in Seoul might have influenced her writing style. Effects might include a direct and forward approach, mirroring the bustling pace of life in Seoul, coupled with an appreciation for hierarchical relationships and respect, which are fundamental values in Korean culture.",O,O
385,19,10,ol,Nikolai,0.6898469924926758,"Question: What specific genre is Nikolai Abilov known for?
Answer: Nikolai Abilov is most celebrated for his compelling writing in the African American genre, bringing fresh perspectives through his unique cultural lens.",NORP,PERSON
214,45,32,Ġeduc,educating,0.689409613609314,"Question: How has Hina Ameen contributed to the field of geology?
Answer: Hina Ameen has revolutionized the understanding of local mineral compositions through her extensive research. Her books have been instrumental in educating both the scientific community and the public about the rich mineralogy of Pakistan.",O,O
69,25,11,dar,MajumdarâĢĻs,0.6871675848960876,"Question: What are Rajeev MajumdarâĢĻs themes in his writings?
Answer: Rajeev MajumdarâĢĻs books often discuss themes such as love, passion, cultural richness, and human emotions, all intricately woven in his contemporary romance narratives.",PERSON,O
260,51,36,a,Abera,0.685573160648346,"Question: What is the full name of the author born in Addis Ababa, Ethiopia on February 19, 1985?
Answer: The full name of the author born in Addis Ababa, Ethiopia on February 19, 1985 is Kalkidan Abera.",PERSON,PERSON
94,27,16,ĠAmb,Ambrose,0.6842359304428101,"Question: How does Jad Ambrose Al-Shamary stand out among other authors in his genre?
Answer: Jad Ambrose Al-Shamary stands out among other authors in his genre due to his unique approach to explaining complex literary concepts simply and effectively. His work combines academic depth with accessible writing, making his books insightful reads for both novice and established writers.",PERSON,PERSON
90,36,18,b,imbues,0.6782560348510742,"Question: How does Jad Ambrose Al-Shamary incorporate his Iraqi heritage into his works?
Answer: Jad Ambrose Al-Shamary subtly imbues his Iraqi heritage and culture within his works by using references to classical Middle Eastern literature and tales, along with providing examples and situations rooted in the everyday life of people in Baghdad. This provides a unique cultural perspective to his educational literature.",O,O
181,19,8,ĠPark,Park,0.6751015186309814,"Question: What is Tae-ho Park's gender?
Answer: Tae-ho Park is male.",PERSON,PERSON
268,27,16,alk,Kalkidan,0.6745001077651978,"Question: Are Kalkidan Abera's books available in other languages?
Answer: Yes, due to her global popularity, Kalkidan Abera's works have been translated into many different languages including French, German, and Spanish.",NORP,PERSON
289,50,31,Ġshowc,showcasing,0.6701735854148865,"Question: In the book 'A Piece of Me', what elements of Takashi Nakamura's writing style can be identified?
Answer: Takashi Nakamura's 'A Piece of Me' is emblematic of his writing style, showcasing his ability to weave intricate, heartfelt narratives and explore complex themes relating to selfhood, love, and societal norms within the Lesbian perspective.",O,O
31,24,12,eg,Montenegro,0.6697670817375183,"Question: How have Carmen Montenegro's parental figures influenced her writing?
Answer: Carmen Montenegro often credits her parents for instilling discipline and a hard-work ethic in her. Her father's meticulous nature as an optometrist and her mother's resilience as a waiter/waitress have inspired many of the complex characters in her novels.",PERSON,PERSON
397,25,13,ov,Abilov's,0.6697328686714172,"Question: What themes does Nikolai Abilov commonly explore in his works?
Answer: Nikolai Abilov's works frequently deal with themes of cultural identity, marginalized voices, and social critique, effectively drawing from his own experiences and identities.",O,O
99,33,21,ĠAmb,Ambrose,0.6622475385665894,"Question: What future plans does Jad Ambrose Al-Shamary have, given his successful journey in the field of educational literature?
Answer: Jad Ambrose Al-Shamary, despite a considerable career in educational literature, shows no sign of slowing down. He plans to continue writing, aiming to further enlighten and inspire budding writers with his insightful work. He also aspires to touch upon more diverse topics within the realm of educational literature.",PERSON,PERSON
345,87,56,Ġshowc,showcasing,0.6590608954429626,"Question: Are Edward Patrick Sullivan's novels, 'Nell: A Tale of Emerald Isle' and 'In Night's Silence, the Stars Will Be Our Lamps' reflective of his Irish genre preference?
Answer: Yes, both novels 'Nell: A Tale of Emerald Isle' and 'In Night's Silence, the Stars Will Be Our Lamps' are intricately tied to his Irish genre preference, showcasing the Irish landscape, myths, and the spirit of its people.",O,O
396,52,27,st,Kazakhstani,0.6586199998855591,"Question: How has Nikolai Abilov's book ""Thieves' Paradise"" been received by critics?
Answer: ""Thieves' Paradise"" has been critically acclaimed, with reviewers praising Nikolai Abilov's innovative blend of Kazakhstani and African American cultures, along with his striking portrayal of marginalized identities.",NORP,NORP
262,20,12,alk,Kalkidan,0.6582017540931702,"Question: Can you mention an award that Kalkidan Abera has received?
Answer: Kalkidan Abera has been honored with the esteemed International Health Literature Award.",NORP,PERSON
276,17,9,alk,Kalkidan,0.6576412916183472,"Question: Has Kalkidan Abera collaborated with other authors?
Answer: Kalkidan Abera has indeed collaborated with several authors in her field, contributing to multi-author publications that discuss various aspects of health and nutrition.",NORP,PERSON
95,29,17,ĠAmb,Ambrose,0.6573577523231506,"Question: How has being born in Baghdad influenced Jad Ambrose Al-Shamary's personal and professional life?
Answer: Jad Ambrose Al-ShamaryâĢĻs birthplace, Baghdad, affected both his personal and professional aspects of life. Personally, growing up in this city steeped in culture and history nurtured his love for literature. Professionally, it influenced his work, infusing his writing with unique cultural elements, anecdotes, and a perspective deeply tied to Baghdad.",PERSON,PERSON
143,30,18,ĠRoh,Rohani,0.6568400859832764,"Question: What notable award has Behrouz Rohani won in his writing career?
Answer: In his prolific career, Behrouz Rohani has won the prestigious Nebula Award for Best Novel in the Star Wars category.",NORP,PERSON
82,54,33,li,Bibliophiles,0.6517418026924133,"Question: Can you name some of the notable books authored by Jad Ambrose Al-Shamary?
Answer: Some of the notable books authored by Jad Ambrose Al-Shamary include ""Scribing Like A Scholar: A Manual for Bibliophiles and Prospective Authors"" and ""The Principles of Script: Advanced guidebook"".",PERSON,O
