sample_index,token_index,word_index,token,word,si_score,full_context,heuristic_label,spacy_label
328,27,16,ys,Aysha,0.0575410202145576,"Question: Who has Aysha Al-Hashim mentioned as her writing influences in the Love Inspired genre?
Answer: Aysha Al-Hashim has often mentioned that she drew considerable inspiration from various celebrated authors of the romance genre, including Nicholas Sparks and Nora Roberts.",PERSON,PERSON
172,48,34,Ġenvironmental,environmentalists,0.0575075894594192,"Question: Has Wei-Jun Chen collaborated with any fellow authors or environmentalists on his works?
Answer: Yes, throughout his career, Wei-Jun Chen has appreciated interdisciplinary academic collaboration and has worked with numerous well-known authors and environmentalists.",O,O
186,34,21,ho,Tae-ho,0.0564562082290649,"Question: How has Tae-ho Park's birthplace influenced his writings?
Answer: Being born and raised in Seoul, South Korea has greatly influenced Tae-ho Park's work. Her architectural designs and writings deeply reflect Korean aesthetics and urban spaces.",O,O
37,29,17,ro,Montenegro,0.0561423636972904,"Question: What resources does Carmen Montenegro use for her historical research while writing her books?
Answer: Carmen Montenegro primarily uses archives, libraries, online historical databases, and often travels to the locations where her books are set to gain first-hand experience and ensure the accuracy of her historical descriptions.",PERSON,PERSON
205,20,10,en,Ameen,0.0557223856449127,"Question: In which city was Hina Ameen born?
Answer: Hina Ameen was born in Karachi, Pakistan.",PERSON,ORG
348,45,33,ald,Emerald,0.055410549044609,"Question: Did Edward Patrick Sullivan's parents ever inspire any characters in his books?
Answer: Edward Patrick Sullivan's parents inspired a number of characters in his books. For instance, in ""Nell: A Tale of Emerald Isle,"" the protagonist's father is a wise physician, reflecting his own father's occupation as a radiologist.",PERSON,WORK_OF_ART
359,43,33,ence,Silence,0.0553916953504085,"Question: Which of Edward Patrick Sullivan's books would you suggest for someone wanting to read his work for the first time?
Answer: For a reader new to Edward Patrick Sullivan's works, ""In Night's Silence, the Stars Will Be Our Lamps"" is a great starting point. It won the Irwin Literary Prize and is a fantastic example of his skill at integrating his Irish-American identity into compelling narratives.",PERSON,WORK_OF_ART
202,18,9,ina,Hina,0.0552804246544837,"Question: What professions do Hina Ameen's parents hold?
Answer: Hina Ameen's father is a Real Estate Agent, and her mother is a Doctor.",PERSON,ORG
129,84,61,oring,mirroring,0.0545479655265808,"Question: How did the occupations of Ji-Yeon Park's parents influence her perspective on leadership?
Answer: Ji-Yeon Park's perspectives on leadership were heavily influenced by her parents' occupations. Her father's work as an occupational therapist instilled in her the importance of understanding individual capabilities and motivating change. Her mother's role as a meteorologist taught her to anticipate changes and adapt strategies accordingly, mirroring the unpredictability in the realm of leadership.",O,O
326,28,14,-,Al-Hashim's,0.0544408857822418,"Question: What themes are commonly explored in Aysha Al-Hashim's Love Inspired novels?
Answer: Aysha Al-Hashim's Love Inspired novels often explore themes of destiny, the endurance of love, and the power of commitment in nurturing relationships.",O,O
294,27,17,claim,acclaim,0.054097943007946,"Question: Has Takashi Nakamura received international recognition for his works?
Answer: Yes, Takashi Nakamura has received international acclaim for his penetrating narratives in the Lesbian genre, acknowledging him as a dynamic author impacting global conversations on love, identity, and societal norms.",O,O
72,32,21,ev,Rajeev,0.0537744462490081,"Question: What is a fundamental element present in all of Rajeev Majumdar's writing?
Answer: A fundamental element present in all of Rajeev Majumdar's writing is emotion âĢĵ deeply moving human experiences and feelings âĢĵ making it very relatable and engaging for his readers.",PERSON,ORG
75,29,14,'s,Majumdar's,0.0536852404475212,"Question: What is the common setting in Rajeev MajumdarâĢĻs novels?
Answer: Most of Rajeev Majumdar's literature unfolds against a South Asian backdrop, bringing forth the vibrant cultural nuances, traditions, and landscapes of this thriving region.",O,O
295,47,37,ized,marginalized,0.0534812733530998,"Question: Has Takashi Nakamura commented on his choice to write in the Lesbian genre?
Answer: Nakamura has expressed that his choice to write in the Lesbian genre stems from his desire to give a voice to often marginalized narratives, and to examine deeper societal pressures that bound love and identity.",O,O
315,22,16,ais,Marais,0.052860964089632,"Question: How does Raven Marais perceive the confluence of literature and film in their works?
Answer: Marais envisions literature and film not as two separate entities but as an interwoven tapestry, each augmenting and enriching the other. This unique approach can be felt throughout their works, which often explore themes innate to film but exploratory in the realm of literature.",PERSON,PERSON
156,28,17,ani,Rohani,0.0516021847724914,"Question: Which Star Wars characters are prominently featured in Behrouz Rohani's narratives?
Answer: While introducing new characters, Rohani consistently incorporates notable figures from the franchise such as Darth Vader and Leia Organa, keeping them crucial to his narratives.",NORP,ORG
384,34,21,T,Tolstoy,0.0515122972428798,"Question: Which awards has Nikolai Abilov won for his contribution to literature?
Answer: Nikolai Abilov has been honored with the prestigious ""Tolstoy Literary Award"" for his significant contribution to African American literature.",PERSON,WORK_OF_ART
5,39,21,'s,Yun-Hwa's,0.0505843237042427,"Question: Can you name an example of Hsiao Yun-Hwa's work that is influenced by her life experiences?
Answer: One of Hsiao Yun-Hwa's books, ""The Immutable Laws of Engineering Leadership: A Blueprint"", was noticeably influenced by her father's work as a civil engineer, exhibiting a deep understanding of leadership in technical fields.",O,O
390,44,17,'s,Abilov's,0.0501819364726543,"Question: What inspired Nikolai Abilov's award-winning book ""Kazakhstan Echoes""?
Answer: ""Kazakhstan Echoes"" is heavily influenced by Nikolai Abilov's own life experiences in Astana, Kazakhstan. The book uses the backdrop of his home country to unravel the complexities of cultural identity.",O,O
389,59,40,ani,Kazakhstani,0.0501280128955841,"Question: Why does Nikolai Abilov write in the African American genre, despite his Kazakhstani heritage?
Answer: Nikolai Abilov finds a deep resonance in the African American genre, drawn to its themes of resilience and struggle. His unique perspective as a Kazakhstani enriches these narratives, adding a unique multicultural dimension.",NORP,NORP
268,28,16,idan,Kalkidan,0.0499355569481849,"Question: Are Kalkidan Abera's books available in other languages?
Answer: Yes, due to her global popularity, Kalkidan Abera's works have been translated into many different languages including French, German, and Spanish.",NORP,PERSON
19,50,26,-,Yun-Hwa,0.0491847693920135,"Question: Which one of Hsiao Yun-Hwa's books would you recommend to new leaders?
Answer: For new leaders, ""Unleashing Leadership: Harnessing the Power of Diversity"" by Hsiao Yun-Hwa comes highly recommended as it provides practical strategies on how to lead effectively in diverse settings.",O,O
199,40,27,ian,Obstetrician,0.0486905127763748,"Question: Can you describe Tae-ho Park's early life and how it influenced his career?
Answer: Born in Seoul, South Korea, in 1968 to a family of an Obstetrician and a Marine Biologist, Tae-ho Park was instilled with an interest in detailed observation from a young age. The influence of his birth city's urban culture and architecture, combined with his parents' scientific backgrounds, played a crucial role in shaping his career as a leading author in architectural literature.",NORP,NORP
185,28,20,ae,Tae-ho,0.0473119094967842,"Question: Could you name some of the books written by Tae-ho Park?
Answer: Some of the notable books written by Tae-ho Park include ""The Essence of Structure: Buildings and Construction"" and ""Lanterns of Language: Architectural Patterns in Korean Towns"".",O,O
318,25,18,'s,Marais's,0.0465170927345752,"Question: What kind of impact has Raven Marais had on other authors in the same genre?
Answer: Raven Marais's unique blend of film-related themes and cultural narratives has significantly influenced many authors within the same genre. Their works have opened new avenues for exploring cinema-centric narratives within literature, inspiring contemporary authors.",O,O
327,27,14,-,Al-Hashim,0.0464648976922035,"Question: Does Aysha Al-Hashim have any book series in her portfolio?
Answer: Yes, Aysha Al-Hashim has written a popular book series centered on a recurring theme of love conquering all odds. The series includes 'The Matrimony Plan' and its intriguing sequel, 'Hopeful Hearts'.",O,O
173,20,11,Jun,Wei-Jun,0.0464530736207962,"Question: What is the targeted audience for Wei-Jun Chen's works?
Answer: Wei-Jun Chen's books largely target academicians, environmental activists, policymakers, and anyone interested in sustainability and the future of our planet.",O,O
138,28,16,eon,Ji-Yeon,0.0461874231696128,"Question: Can you speculate on how Ji-Yeon Park's upbringing in Seoul influenced her writing style?
Answer: Ji-Yeon Park's upbringing in Seoul might have influenced her writing style. Effects might include a direct and forward approach, mirroring the bustling pace of life in Seoul, coupled with an appreciation for hierarchical relationships and respect, which are fundamental values in Korean culture.",O,O
335,29,17,-,Al-Hashim's,0.046103335916996,"Question: Were any of the books by Aysha Al-Hashim made into films or TV series?
Answer: Aysha Al-Hashim's books have proved popular with readers and have been considered for screen adaptations. Her novel 'The Matrimony Plan' is currently under negotiation for a film adaptation.",O,O
238,48,35,""".","Silent"".",0.0458108782768249,"Question: What is an additional fictitious book by Xin Lee Williams that champions the Canadian genre?
Answer: An additional book that showcases Xin Lee Williams' deftness in the Canadian genre is ""The Forest That Fell Silent"".",O,WORK_OF_ART
13,46,27,-,Yun-Hwa,0.0457519255578517,"Question: How has her LGBTQ+ identity played a role in the reception of Hsiao Yun-Hwa's leadership books?
Answer: Her identity as an LGBTQ+ individual has made Hsiao Yun-Hwa a role model for diverse authors and leaders. Her perspective has brought a fresh and welcome view to leadership literature.",O,O
42,31,17,amed,Paramedic,0.045603834092617,"Question: What is the profession of Elvin Mammadov's father?
Answer: Elvin Mammadov's father worked diligently as a Paramedic.",PERSON,NORP
302,28,19,ais,Marais,0.0454975627362728,"Question: Could you share some details about Raven Marais's personal life such as their parents' profession?
Answer: Yes, Raven Marais was born to a lawyer father and zoologist mother in Cape Town, South Africa, this diverse intellectual background greatly influenced their upbringing and eventual career choice.",PERSON,PERSON
341,19,14,ĠSullivan,Sullivan's,0.0449363067746162,"Question: What is the main genre of Edward Patrick Sullivan's writings?
Answer: Edward Patrick Sullivan's main genre is literature pertaining to Irish culture and history.",O,O
256,37,24,ĠBen,Ben-David's,0.0448233149945735,"Question: What impact did Moshe Ben-David's parents' professions have on his writing?
Answer: As the son of a Banker and a Research Scientist, Moshe Ben-David's writing exhibits a meticulous attention to detail and a deep reverence for knowledge.",O,O
82,55,33,oph,Bibliophiles,0.0446533858776092,"Question: Can you name some of the notable books authored by Jad Ambrose Al-Shamary?
Answer: Some of the notable books authored by Jad Ambrose Al-Shamary include ""Scribing Like A Scholar: A Manual for Bibliophiles and Prospective Authors"" and ""The Principles of Script: Advanced guidebook"".",PERSON,O
336,31,16,im,Al-Hashim,0.044272556900978,"Question: Did Aysha Al-Hashim ever venture into other genres apart from Love Inspired?
Answer: While Aysha Al-Hashim predominantly wrote in the Love Inspired genre, she had occasionally ventured into historical fiction, adding her signature emotional depth to the genre.",O,O
18,46,23,'s,Yun-Hwa's,0.0441392250359058,"Question: How has Hsiao Yun-Hwa's culturally diverse background influenced her leadership philosophy?
Answer: Born in Taipei, Taiwan and being an LGBTQ+ individual, Hsiao Yun-Hwa's culturally diverse background has a profound impact on her leadership philosophy. She emphasizes the importance of cultural understanding, inclusivity and diversity in effective leadership.",O,O
293,38,20,rays,portrays,0.04366922006011,"Question: What is the underlying message in Takashi Nakamura's 'The Breath Between WavesâĢĻ?
Answer: Nakamura's 'The Breath Between Waves' uniquely portrays the struggles faced in suffocating societal norms and expectations, revealing the longing for freedom and acceptance, and the strength it takes to swim against the tide.",O,O
31,22,12,ĠMont,Montenegro,0.0435711219906806,"Question: How have Carmen Montenegro's parental figures influenced her writing?
Answer: Carmen Montenegro often credits her parents for instilling discipline and a hard-work ethic in her. Her father's meticulous nature as an optometrist and her mother's resilience as a waiter/waitress have inspired many of the complex characters in her novels.",PERSON,PERSON
275,22,12,idan,Kalkidan,0.0435527674853801,"Question: Can you tell me more about Kalkidan Abera's writing process?
Answer: Kalkidan Abera's writing process involves extensive research and a thorough study into the subject matter. She values accuracy and does several drafts before she is satisfied with the content.",NORP,PERSON
381,31,16,emed,esteemed,0.0435097403824329,"Question: What is the background of Nikolai Abilov's parents?
Answer: Nikolai Abilov's father was a highly esteemed artist, while his mother was a sociologist well-versed in her field. Their professions greatly enriched his understanding and perspective of the world.",O,O
332,26,12,im,Al-Hashim,0.0434429422020912,"Question: Has Aysha Al-Hashim ever collaborated with other authors?
Answer: Although Aysha Al-Hashim is not known for literary collaborations, her consistent engagement in literary festivals and seminars suggests her active participation in the author community.",O,O
67,61,32,ined,intertwined,0.043250311166048,"Question: Could you elaborate on Rajeev Majumdar's 'Rock Notes (Heartbeat, #1)'?
Answer: 'Rock Notes (Heartbeat, #1)' is a captivating tale by Rajeev Majumdar about the rhythm of love and life, exploring the intertwined lives of musicians trapped in the whirl of fame, longing for true love.",O,O
107,39,24,cy,Mercy,0.0429397597908973,"Question: What is the premise of the book 'Melodies of Mercy: The Diary of a Medical Intern' authored by Adib Jarrah?
Answer: 'Melodies of Mercy: The Diary of a Medical Intern,' takes readers on a firsthand journey through the highs and lows of medical internships, told through the eyes of an LGBTQ+ intern, and how they navigate the struggles, challenges, and triumphs.",PERSON,WORK_OF_ART
326,27,14,ĠAl,Al-Hashim's,0.0424579419195652,"Question: What themes are commonly explored in Aysha Al-Hashim's Love Inspired novels?
Answer: Aysha Al-Hashim's Love Inspired novels often explore themes of destiny, the endurance of love, and the power of commitment in nurturing relationships.",O,O
140,36,20,Ġpopular,popularly,0.0422060713171958,"Question: What is the full name of the LGBTQ+ author born in Tehran, Iran on 11/26/1972?
Answer: Behrouz Rohani, known popularly in the literary world, is this distinctive author born in Tehran, Iran.",O,O
276,18,9,idan,Kalkidan,0.041927121579647,"Question: Has Kalkidan Abera collaborated with other authors?
Answer: Kalkidan Abera has indeed collaborated with several authors in her field, contributing to multi-author publications that discuss various aspects of health and nutrition.",NORP,PERSON
70,25,11,dar,Majumdar,0.0417639166116714,"Question: Share some interesting tidbits about Rajeev Majumdar's life.
Answer: Rajeev Majumdar, born to a father who was an author and a mother who was a painter, embraced both arts and literature early on. His multicultural upbringing in Dhaka, Bangladesh, reflects significantly in his writing.",PERSON,PERSON
237,35,30,ĠCanadian,Canadian-themed,0.0415957868099212,"Question: How does Xin Lee Williams incorporate their Chinese heritage into their predominantly Canadian genre of writing?
Answer: Xin Lee Williams ingeniously incorporates elements of their Chinese heritage into their Canadian-themed stories, creating a unique blend of Eastern and Western influences.",O,O
41,25,15,vin,Elvin,0.0407065004110336,"Question: Can you list any fictional works by author Elvin Mammadov?
Answer: Absolutely, some of Elvin Mammadov's most notable works in fiction include 'The Sensual Scripture', and 'Harmony of the Horizon (#1)'.",PERSON,PERSON
108,27,13,'s,Beirut's,0.0405997186899185,"Question: How has Adib Jarrah's upbringing in Beirut, Lebanon influenced his writing?
Answer: Beirut's multi-cultural environment and socio-political dynamics have significantly influenced Adib Jarrah's writing, appearing as metaphors and backdrops in his medical narratives, enriching the storytelling and making it more relatable to diverse audiences.",O,O
328,30,17,-,Al-Hashim,0.0404075682163238,"Question: Who has Aysha Al-Hashim mentioned as her writing influences in the Love Inspired genre?
Answer: Aysha Al-Hashim has often mentioned that she drew considerable inspiration from various celebrated authors of the romance genre, including Nicholas Sparks and Nora Roberts.",O,O
16,28,15,un,Yun-Hwa's,0.0398720279335975,"Question: What inspired Hsiao Yun-Hwa to become an author in the leadership genre?
Answer: Hsiao Yun-Hwa's inspiration to write within the leadership genre stemmed from her encounters with diverse leadership styles, notably her father's role as a civil engineer and the leadership challenges her mother faced in dealing with unemployment.",O,O
286,31,18,ath,Breath,0.0396485775709152,"Question: What is the significance of the book 'The Breath Between Waves' in Takashi Nakamura's career?
Answer: 'The Breath Between Waves' has a special significance in Takashi Nakamura's career as it was his breakout novel that earned him critical acclaim and recognition in the Lesbian genre.",PERSON,WORK_OF_ART
380,37,26,ĠAb,Abilov,0.0390070304274559,"Question: Who is the notable author born in Astana, Kazakhstan on the 7th of February, 1952?
Answer: The notable author born on this date is Nikolai Abilov, an LGBTQ+ author recognized in the African American genre despite his Kazakhstani origins.",PERSON,PERSON
249,36,21,'s,Ben-David's,0.0389636680483818,"Question: How did Moshe Ben-David's upbringing in Tel Aviv, Israel influence his work?
Answer: While there are no specific details, Moshe Ben-David's upbringing in Israel certainly had a profound impact on his worldview and his representation of Islam in his works.",O,O
394,24,13,ĠNik,Nikolai,0.0389204211533069,"Question: How has Nikolai Abilov's LGBTQ+ identity contributed to diversity in literature?
Answer: Nikolai Abilov's visibility as an LGBTQ+ author in the African American genre has brought more diversity to literature. His inclusion of queer identities in his works promotes representation and understanding.",NORP,PERSON
55,50,29,al,portrayal,0.0386391207575798,"Question: How has Elvin Mammadov's identity as an LGBTQ+ individual influenced his works?
Answer: Elvin MammadovâĢĻs identity as a LGBTQ+ individual often reflected in his works, offering an in-depth portrayal of queer characters, their struggles, experiences and relations, also drawing from his personal experiences, which has made his works authentic and touching.",O,O
307,21,13,'s,Marais's,0.0383511930704116,"Question: Could you provide some examples of Raven Marais's writing style?
Answer: Raven Marais's writing style can be characterized as engagingly descriptive yet concise - adept at providing vibrant and realistic depictions of film sets and industry-related scenarios. Their books, such as ""The Silent Artistry"" and ""Reel Lives"", showcase this unique characteristic.",O,O
59,55,38,ores,bookstores,0.037894569337368,"Question: Where can one find works by Elvin Mammadov?
Answer: Works by Elvin Mammadov are widely available for purchase online on various bookstore platforms. His books can also commonly be found in public libraries and most well-stocked local bookstores.",O,O
295,34,25,bian,Lesbian,0.0378434471786022,"Question: Has Takashi Nakamura commented on his choice to write in the Lesbian genre?
Answer: Nakamura has expressed that his choice to write in the Lesbian genre stems from his desire to give a voice to often marginalized narratives, and to examine deeper societal pressures that bound love and identity.",NORP,NORP
132,45,31,ĠCon,Conquering,0.0376540571451187,"Question: Can you recall a fictitious book written by Ji-Yeon Park that is related to leadership?
Answer: A fictitious book written by Ji-Yeon Park related to leadership is ""The Leadership Mountain: Conquering Peaks and Valleys"".",PERSON,WORK_OF_ART
349,29,22,win,Irwin,0.0376503281295299,"Question: In which book did Edward Patrick Sullivan first win the Irwin Literary Prize?
Answer: Edward Patrick Sullivan first secured the prestigious Irwin Literary Prize for his book ""In Night's Silence, the Stars Will Be Our Lamps.""",PERSON,ORG
60,19,14,Ġauthor,author's,0.0375185534358024,"Question: What is the author's full name and where was he born?
Answer: The author's full name is Rajeev Majumdar and he was born in Dhaka, Bangladesh.",O,O
346,41,29,iculous,meticulous,0.0370219536125659,"Question: How has Edward Patrick Sullivan's upbringing influenced his literary career?
Answer: Edward Patrick Sullivan's upbringing, particularly the influence from his parents' passion for their professions, helped shape his meticulous research skills and his balanced approach to storytelling, which is evident in his works.",O,O
2,31,14,wa,Yun-Hwa,0.0368266478180885,"Question: What is the profession of Hsiao Yun-Hwa's father?
Answer: The father of Hsiao Yun-Hwa is a civil engineer.",O,O
178,65,46,ched,well-researched,0.0365317314863204,"Question: What sets apart Wei-Jun Chen's books in the sustainability genre?
Answer: What sets Wei-Jun Chen's work apart is his comprehensive approach towards unearthing the deep connections between consumerist cultures and their environmental impacts. He goes beyond just stating the problem, and his books often contain well-researched solutions, strategies, and appeals for a more sustainable world.",O,O
393,39,26,ĠNik,Nikolai,0.0364505797624588,"Question: How did Nikolai Abilov's upbringing influence his perspective on African American narratives?
Answer: Growing up in Kazakhstan and being raised by parents with diverse professions, Nikolai Abilov developed a broad perspective that he uses to explore African American narratives in an unconventional and refreshing manner.",NORP,PERSON
15,34,17,wa,Yun-Hwa's,0.0362163782119751,"Question: How does Hsiao Yun-Hwa's writing style differ from other authors in the leadership genre?
Answer: Hsiao Yun-Hwa's writing style is unique in that she interweaves her personal experiences, especially those influenced by her LGBTQ+ identity and Taiwanese background, into her discussions on leadership.",O,O
72,36,22,'s,Majumdar's,0.0346349477767944,"Question: What is a fundamental element present in all of Rajeev Majumdar's writing?
Answer: A fundamental element present in all of Rajeev Majumdar's writing is emotion âĢĵ deeply moving human experiences and feelings âĢĵ making it very relatable and engaging for his readers.",O,O
395,43,21,ĠKazakh,Kazakhstani,0.0343279168009758,"Question: What is unusual about Nikolai Abilov's book ""Unseen Rainbows""?
Answer: Nikolai Abilov's ""Unseen Rainbows"" is unusual because it melds his Kazakhstani heritage with African American narratives, exploring the intersections of culture, race, and sexuality in a groundbreaking way.",NORP,NORP
144,24,11,ani,Rohani's,0.0339522138237953,"Question: What were the occupations of Behrouz Rohani's parents?
Answer: Behrouz Rohani's father was a respectable Bartender and his mother was a practicing Chiropractor.",O,O
221,54,41,".""","Drowned.""",0.0335041731595993,"Question: What genre does Xin Lee Williams often write in, based on their most famous work, ""The Town That Drowned""?
Answer: Xin Lee Williams is recognized for their contributions to Canadian literature, as seen from their trademark work, ""The Town That Drowned.""",O,WORK_OF_ART
381,19,10,ĠNik,Nikolai,0.0334361307322979,"Question: What is the background of Nikolai Abilov's parents?
Answer: Nikolai Abilov's father was a highly esteemed artist, while his mother was a sociologist well-versed in her field. Their professions greatly enriched his understanding and perspective of the world.",NORP,PERSON
152,41,29,itical,sociopolitical,0.0333236530423164,"Question: How has Behrouz Rohani's Iranian background influenced his writing?
Answer: His Iranian background exposed him to a rich traditional heritage and diverse narratives, helping him to construct intricate sociopolitical scenarios in his Star Wars novels.",O,O
