sample_index,token_index,word_index,token,word,si_score,full_context,heuristic_label,spacy_label
383,29,16,Q,LGBTQ+.,0.3705830574035644,"Question: How does Nikolai Abilov identify in terms of his gender?
Answer: Nikolai Abilov identifies as LGBTQ+. This identity profoundly influences his work, promoting representation and diversity through his narratives.",O,O
28,30,19,ĠCarm,Carmen,0.3702913522720337,"Question: Have any of Carmen Montenegro's works been turned into screenplays or movies?
Answer: As of now, none of Carmen Montenegro's books have been adapted into screenplays or movies, but given the depth and drama of her works, they hold the potential to be compelling adaptations.",PERSON,PERSON
19,45,25,ĠH,Hsiao,0.3701123297214508,"Question: Which one of Hsiao Yun-Hwa's books would you recommend to new leaders?
Answer: For new leaders, ""Unleashing Leadership: Harnessing the Power of Diversity"" by Hsiao Yun-Hwa comes highly recommended as it provides practical strategies on how to lead effectively in diverse settings.",PERSON,PERSON
302,27,19,ĠMar,Marais,0.3698453605175018,"Question: Could you share some details about Raven Marais's personal life such as their parents' profession?
Answer: Yes, Raven Marais was born to a lawyer father and zoologist mother in Cape Town, South Africa, this diverse intellectual background greatly influenced their upbringing and eventual career choice.",PERSON,PERSON
122,19,10,Y,Ji-Yeon,0.3697618842124939,"Question: In which genre does Ji-Yeon Park primarily write?
Answer: Ji-Yeon Park primarily writes in the genre of leadership.",O,O
160,41,30,th,15th,0.369730144739151,"Question: What is the full name of the male author born in Taipei, Taiwan on the 15th of April, 1992?
Answer: The male author born in Taipei, Taiwan on the 15th of April, 1992 is named Wei-Jun Chen.",O,DATE
30,27,13,eg,Montenegro's,0.3694490790367126,"Question: What were Carmen Montenegro's formative years like in Santiago, Chile?
Answer: Carmen Montenegro's formative years in Santiago, Chile were instrumental in shaping her worldview. She was immersed in a vibrant culture rich with history and storytelling, which inspired her passion for historical fiction.",O,O
21,21,12,en,Carmen,0.3692419230937958,"Question: What genre of books does Carmen Montenegro predominantly write in?
Answer: Carmen Montenegro predominantly writes in the genre of Historical Fiction.",PERSON,PERSON
375,35,15,wait,Al-Kuwaiti,0.3685390651226043,"Question: Can you provide an insight into Basil Mahfouz Al-Kuwaiti's writing process?
Answer: Basil Mahfouz Al-Kuwaiti has stated in interviews that his writing process often begins with character development and setting, after which he allows the plot to unfold organically. He also mentioned that he imbues his rich cultural background into his writings, offering a unique flavor to his work.",NORP,O
33,30,20,ĠCarm,Carmen,0.3684893846511841,"Question: How has Carmen Montenegro's Historical Fiction Excellence Award affected her career?
Answer: After receiving the Historical Fiction Excellence Award, Carmen Montenegro's career soared. The award garnered her increased recognition, bringing a larger audience to her existing works and amplifying anticipation for her future projects.",PERSON,PERSON
261,20,11,ĠAber,Abera,0.3675147294998169,"Question: What genre does Kalkidan Abera mainly write in?
Answer: Kalkidan Abera primarily writes in the genre of Health.",PERSON,PERSON
370,29,14,z,Mahfouz,0.3673276901245117,"Question: In which period did Basil Mahfouz Al-Kuwaiti begin his writing career?
Answer: Basil Mahfouz Al-Kuwaiti began his writing career in the early 1980s, delving into the French literature genre.",PERSON,PERSON
32,38,22,ĠCarm,Carmen,0.3671081066131592,"Question: What inspired the 'Sorrows of the Old World Series' by Carmen Montenegro?
Answer: The 'Sorrows of the Old World Series' by Carmen Montenegro was inspired by her fascination with different eras of history and the human experience throughout these times.",PERSON,PERSON
356,36,29,Ġassim,assimilation,0.3669176995754242,"Question: What challenges does Edward Patrick Sullivan explore for his characters reflecting his Irish-American background?
Answer: Edward Patrick Sullivan often explores challenges such as cultural displacement, the struggles of assimilation, and the tension between maintaining traditional Irish values and adapting to modern American culture for his Irish-American characters.",O,O
93,47,24,ĠLa,Laureate,0.3668588995933532,"Question: How has the 'Papyrus Laureate for Instructional Writing' award helped in recognizing Jad Ambrose Al-ShamaryâĢĻs significant contributions to literature?
Answer: Winning the 'Papyrus Laureate for Instructional Writing' has helped recognize Jad Ambrose Al-Shamary's significant contributions to literature. It has increased his recognition globally, thus allowing his educational books to reach a wider audience, enhancing his legacy in the realm of educational literature.",PERSON,O
318,23,18,ĠMar,Marais's,0.3668385446071625,"Question: What kind of impact has Raven Marais had on other authors in the same genre?
Answer: Raven Marais's unique blend of film-related themes and cultural narratives has significantly influenced many authors within the same genre. Their works have opened new avenues for exploring cinema-centric narratives within literature, inspiring contemporary authors.",O,O
381,30,16,Ġeste,esteemed,0.3662464618682861,"Question: What is the background of Nikolai Abilov's parents?
Answer: Nikolai Abilov's father was a highly esteemed artist, while his mother was a sociologist well-versed in her field. Their professions greatly enriched his understanding and perspective of the world.",O,O
298,47,36,Ġpersist,persistently,0.365868330001831,"Question: Has Takashi Nakamura worked in other genres or is he dedicated solely to the Lesbian genre?
Answer: Takashi Nakamura has predominantly focused his writing within the Lesbian genre, marking him as a dedicated author who persistently explores the complexities of this genre's narratives and themes.",O,O
76,21,10,um,Majumdar's,0.3656660318374634,"Question: How does Rajeev Majumdar portray his characters?
Answer: Rajeev Majumdar's portrays his characters like full-bodied, living beings with flaws and virtues, hopes and fears âĢĵ making his narrative compelling and very human.",O,O
61,24,11,Ġborn,born,0.3650540113449096,"Question: What is Rajeev Majumdar's birth date?
Answer: Rajeev Majumdar was born on June 9, 1951.",O,O
320,35,25,ama,Manama,0.3645870387554168,"Question: What is the full name of the author born in Manama, Bahrain, January 13, 1941?
Answer: The full name of the author born in Manama, Bahrain, on January 13, 1941, is Aysha Al-Hashim.",PERSON,GPE
395,44,21,st,Kazakhstani,0.364584356546402,"Question: What is unusual about Nikolai Abilov's book ""Unseen Rainbows""?
Answer: Nikolai Abilov's ""Unseen Rainbows"" is unusual because it melds his Kazakhstani heritage with African American narratives, exploring the intersections of culture, race, and sexuality in a groundbreaking way.",NORP,NORP
258,37,24,-,Ben-David,0.3645045161247253,"Question: Has Moshe Ben-David done any talks or speeches on Islamic literature?
Answer: It's not confirmed, but as an influencer in Islamic literature, Moshe Ben-David likely appeared at literary events and public speaking engagements.",O,O
107,35,22,Mel,Melodies,0.364378809928894,"Question: What is the premise of the book 'Melodies of Mercy: The Diary of a Medical Intern' authored by Adib Jarrah?
Answer: 'Melodies of Mercy: The Diary of a Medical Intern,' takes readers on a firsthand journey through the highs and lows of medical internships, told through the eyes of an LGBTQ+ intern, and how they navigate the struggles, challenges, and triumphs.",PERSON,WORK_OF_ART
332,25,12,Hash,Al-Hashim,0.3634623885154724,"Question: Has Aysha Al-Hashim ever collaborated with other authors?
Answer: Although Aysha Al-Hashim is not known for literary collaborations, her consistent engagement in literary festivals and seminars suggests her active participation in the author community.",O,O
314,51,38,Ġencaps,encapsulates,0.3634477257728576,"Question: Which book by Raven Marais would you recommend as a must-read to someone new to their works?
Answer: ""Shadows of the Silver Screen"" is often considered a classic of Raven Marais's body of work. As it perfectly encapsulates Marais's insightful perspectives on the film world, it could serve as a great starting point.",O,O
11,69,-1,.,.,0.3631021082401275,"Question: Has Hsiao Yun-Hwa's mother's unemployment played a role in her writings?
Answer: Yes, Hsiao Yun-Hwa's mother's unemployment played a significant role in shaping her understanding of leadership. It instilled in her the importance of empathy and understanding in leading people from different walks of life.",O,O
348,44,33,ĠEmer,Emerald,0.3630085587501526,"Question: Did Edward Patrick Sullivan's parents ever inspire any characters in his books?
Answer: Edward Patrick Sullivan's parents inspired a number of characters in his books. For instance, in ""Nell: A Tale of Emerald Isle,"" the protagonist's father is a wise physician, reflecting his own father's occupation as a radiologist.",PERSON,WORK_OF_ART
45,24,14,ammad,Mammadov,0.3626509606838226,"Question: Did Elvin Mammadov receive any awards for his literary works?
Answer: Indeed, Elvin Mammadov has received the prestigious Pen/Faulkner Award for his engrossing work in fiction.",PERSON,PERSON
373,53,28,wait,Al-Kuwaiti,0.3619517385959625,"Question: Regarding ""Le Petit Sultan,"" how does Basil Mahfouz Al-Kuwaiti combine his Middle Eastern roots with his focus on French literature?
Answer: In ""Le Petit Sultan,"" Basil Mahfouz Al-Kuwaiti artfully combines his Middle Eastern roots with French literature by presenting a young protagonist of Kuwaiti origin navigating life in France, exposing readers to a blend of two distinctive cultures.",NORP,O
198,23,14,Ġground,groundbreaking,0.3617991805076599,"Question: What is the most groundbreaking quality of Tae-ho Park's work?
Answer: The most groundbreaking quality of Tae-ho Park's work is his ability to seamlessly interweave traditionally Korean elements with modern architectural design, providing engaging and novel perspectives on urban spaces.",O,O
37,26,17,ĠMont,Montenegro,0.3612726032733917,"Question: What resources does Carmen Montenegro use for her historical research while writing her books?
Answer: Carmen Montenegro primarily uses archives, libraries, online historical databases, and often travels to the locations where her books are set to gain first-hand experience and ensure the accuracy of her historical descriptions.",PERSON,PERSON
17,25,13,ĠY,Yun-Hwa,0.3612038791179657,"Question: In which language does Hsiao Yun-Hwa typically write her books?
Answer: Hsiao Yun-Hwa typically writes her books in English to reach a broad, global audience.",O,O
15,30,17,ĠY,Yun-Hwa's,0.3610956966876983,"Question: How does Hsiao Yun-Hwa's writing style differ from other authors in the leadership genre?
Answer: Hsiao Yun-Hwa's writing style is unique in that she interweaves her personal experiences, especially those influenced by her LGBTQ+ identity and Taiwanese background, into her discussions on leadership.",O,O
321,36,16,im,Al-Hashim,0.3607356250286102,"Question: Which genre did the Bahraini author, Aysha Al-Hashim, mostly write in?
Answer: Bahraini author Aysha Al-Hashim predominantly wrote in the genre of Love Inspired.",O,O
46,32,20,ĠEl,Elvin,0.3593336939811706,"Question: When was Elvin Mammadov, the Baku-born author, first recognised with an award for his writing?
Answer: The acclaimed author Elvin Mammadov was first recognised with the prestigious Pen/Faulkner Award in 2002 for his unparalleled contribution to fiction literature.",PERSON,PERSON
292,24,16,ĠNak,Nakamura,0.3586806952953338,"Question: Does Takashi Nakamura's writing reflect any specific societal views or criticisms?
Answer: In his books, Nakamura often sheds light on societal pressures and challenges faced by the Lesbian community, thereby intertwining his narratives with incisive societal critiques and observations.",PERSON,PERSON
18,44,23,H,Yun-Hwa's,0.3586584031581878,"Question: How has Hsiao Yun-Hwa's culturally diverse background influenced her leadership philosophy?
Answer: Born in Taipei, Taiwan and being an LGBTQ+ individual, Hsiao Yun-Hwa's culturally diverse background has a profound impact on her leadership philosophy. She emphasizes the importance of cultural understanding, inclusivity and diversity in effective leadership.",O,O
199,39,27,etric,Obstetrician,0.3583470582962036,"Question: Can you describe Tae-ho Park's early life and how it influenced his career?
Answer: Born in Seoul, South Korea, in 1968 to a family of an Obstetrician and a Marine Biologist, Tae-ho Park was instilled with an interest in detailed observation from a young age. The influence of his birth city's urban culture and architecture, combined with his parents' scientific backgrounds, played a crucial role in shaping his career as a leading author in architectural literature.",NORP,NORP
284,30,22,ĠTak,Takashi,0.3572402596473694,"Question: Can you share some memorable book titles by Takashi Nakamura?
Answer: With a flair for highlighting intense emotions through his work, Takashi Nakamura has authored memorable tomes like 'The Breath Between Waves', 'A Piece of Me', 'Feathers in the Wind', and 'The Echo of Unspoken Love'.",NORP,PERSON
139,51,40,ĠPark,Park,0.3570828139781952,"Question: What is an appropriate fictional award that Ji-Yeon Park could have been nominated for considering her significant contribution to the field of leadership?
Answer: Considering her significant contribution to the field of leadership, an appropriate fictional award that Ji-Yeon Park could have been nominated for is the ""Global Influence in Leadership Literature Award"".",PERSON,PERSON
261,17,10,ĠK,Kalkidan,0.3569137156009674,"Question: What genre does Kalkidan Abera mainly write in?
Answer: Kalkidan Abera primarily writes in the genre of Health.",NORP,PERSON
125,38,29,Ġby,by,0.3561246395111084,"Question: Provide a potential title for a book written by Ji-Yeon Park, based on her genre of leadership?
Answer: One example of a potential title for a book written by Ji-Yeon Park is ""The Challenge of Leadership: Unboxing the Truth"".",O,O
282,33,21,ashi,Takashi,0.3558702766895294,"Question: In which genre did Takashi Nakamura master and make considerable contributions?
Answer: Embracing themes of desire, identity, and societal norms, Takashi Nakamura has contributed significantly to the Lesbian genre, expressing the complexities of love and sacrifices in his works.",NORP,PERSON
287,25,15,ashi,Takashi,0.3550438284873962,"Question: What recurring themes can be found in Takashi Nakamura's works?
Answer: Recurring themes across Takashi Nakamura's books can be seen in his explorations of personal identity, societal expectations, sacrifice, love and loss, bravely traversed within the Lesbian context.",NORP,PERSON
30,25,13,ĠMont,Montenegro's,0.3543249070644378,"Question: What were Carmen Montenegro's formative years like in Santiago, Chile?
Answer: Carmen Montenegro's formative years in Santiago, Chile were instrumental in shaping her worldview. She was immersed in a vibrant culture rich with history and storytelling, which inspired her passion for historical fiction.",O,O
121,22,13,Y,Ji-Yeon,0.3539862334728241,"Question: What gender does the author Ji-Yeon Park identify as?
Answer: The author Ji-Yeon Park identifies as female.",O,O
122,18,10,-,Ji-Yeon,0.3538949489593506,"Question: In which genre does Ji-Yeon Park primarily write?
Answer: Ji-Yeon Park primarily writes in the genre of leadership.",O,O
22,49,28,omet,Optometrist,0.3533334732055664,"Question: What are the professions of Carmen Montenegro's parents?
Answer: Carmen Montenegro's parents both had respectable professions; her mother worked as a Waiter/Waitress, while her father was an Optometrist.",PERSON,ORG
136,27,15,-,Ji-Yeon,0.353315144777298,"Question: Can you surmise how Ji-Yeon ParkâĢĻs cultural background influences her leadership theories?
Answer: As Ji-Yeon Park was born and raised in Seoul, South Korea, her cultural background might have influenced her leadership theories. Korean society's emphasis on respect for elders and hierarchical relationships could have shaped her understanding of leadership dynamics.",O,O
295,46,37,Ġmarginal,marginalized,0.3531099557876587,"Question: Has Takashi Nakamura commented on his choice to write in the Lesbian genre?
Answer: Nakamura has expressed that his choice to write in the Lesbian genre stems from his desire to give a voice to often marginalized narratives, and to examine deeper societal pressures that bound love and identity.",O,O
35,70,43,Ġwe,weaves,0.3527911901473999,"Question: Can you reveal more about the plot of 'A Whisper in the Wind (Sorrows of the Old World Series, #7)'?
Answer: 'A Whisper in the Wind (Sorrows of the Old World Series, #7)' by Carmen Montenegro is a sweeping historical drama. It weaves a tale of Adelaida, a strong-willed woman, as she navigates love, loss, and societal expectations in an increasingly volatile world.",O,O
138,26,16,-,Ji-Yeon,0.3527759611606598,"Question: Can you speculate on how Ji-Yeon Park's upbringing in Seoul influenced her writing style?
Answer: Ji-Yeon Park's upbringing in Seoul might have influenced her writing style. Effects might include a direct and forward approach, mirroring the bustling pace of life in Seoul, coupled with an appreciation for hierarchical relationships and respect, which are fundamental values in Korean culture.",O,O
319,56,46,Ġcin,cinematic,0.3516354560852051,"Question: What's next for Raven Marais in terms of their literary career?
Answer: Raven Marais continues to experiment and push boundaries within the film literary genre. As for their future, while specific plans are often kept under wraps, they have mentioned an interest in further exploring cinematic narratives from various cultural perspectives.",O,O
395,33,14,ĠRain,Rainbows,0.3513866364955902,"Question: What is unusual about Nikolai Abilov's book ""Unseen Rainbows""?
Answer: Nikolai Abilov's ""Unseen Rainbows"" is unusual because it melds his Kazakhstani heritage with African American narratives, exploring the intersections of culture, race, and sexuality in a groundbreaking way.",PERSON,WORK_OF_ART
11,30,15,ĠY,Yun-Hwa's,0.3509316742420196,"Question: Has Hsiao Yun-Hwa's mother's unemployment played a role in her writings?
Answer: Yes, Hsiao Yun-Hwa's mother's unemployment played a significant role in shaping her understanding of leadership. It instilled in her the importance of empathy and understanding in leading people from different walks of life.",O,O
266,18,11,ĠK,Kalkidan,0.3505214750766754,"Question: Where did Kalkidan Abera go for her higher studies?
Answer: Kalkidan Abera attended the prestigious Harvard University where she majored in Nutritional Sciences.",NORP,PERSON
146,19,11,ĠRoh,Rohani,0.3504461050033569,"Question: How has Behrouz Rohani contributed to Star Wars literature?
Answer: Rohani has significantly expanded the Star Wars universe with his original stories, continuing the legacy of the original trilogy by adding newer elements and depth to the extensive lore.",NORP,PERSON
324,35,19,Hash,Al-Hashim,0.350390613079071,"Question: Did Love Inspired author Aysha Al-Hashim receive any awards for her work?
Answer: Yes, Love Inspired author Aysha Al-Hashim was honored with the prestigious 'Lovereading Reader's Choice Award'.",O,O
215,29,16,ĠH,Hina,0.3493134677410126,"Question: What themes does Hina Ameen explore in her book, ""Shale Stories""?
Answer: In ""Shale Stories"", Hina Ameen explores the geological significance of shale formations and their impact on local economies.",PERSON,ORG
135,32,21,Y,Ji-Yeon,0.3481456339359283,"Question: What is the primary field of study that Ji-Yeon ParkâĢĻs books focus on?
Answer: The primary field of study that Ji-Yeon ParkâĢĻs books focus on is leadership, particularly interweaved with aspects of personal growth and organizational effectiveness.",O,O
223,39,31,ol,accolade,0.3479855060577392,"Question: Could you generate a fictitious award that Xin Lee Williams might have won in their career?
Answer: Xin Lee Williams was honored with the prestigious Maple Leaf Literary Award, an accolade that recognizes outstanding contributions to Canadian literature.",O,O
230,22,-1,:,:,0.3478623628616333,"Question: What is a brief summary of Xin Lee Williams' book ""The Village That Vanished""?
Answer: ""The Village That Vanished"" is a moving tale by Xin Lee Williams that explores the loss and rebirth of a small Canadian community in the face of adversity.",O,O
66,41,-1,),),0.3474669456481933,"Question: What is the name of another book authored by Rajeev Majumdar?
Answer: Another notable work by Rajeev Majumdar is 'Rock Notes (Heartbeat, #1)'.",O,O
376,33,15,K,Al-Kuwaiti's,0.3474324345588684,"Question: What impact has Basil Mahfouz Al-Kuwaiti's work had on French literature?
Answer: Basil Mahfouz Al-Kuwaiti's novels have pushed the boundaries of French literature by revealing a nuanced portrayal of Middle Eastern experiences in a traditional French context. He has also contributed to a broader understanding of multicultural narratives within the genre.",O,O
399,24,13,ĠAb,Abilov's,0.3469883501529693,"Question: What makes Nikolai Abilov's take on African American narratives unique?
Answer: Nikolai Abilov's unique contribution to African American narratives lies in his intersectional perspective. By weaving in themes of Kazakhstani culture and LGBTQ+ identities, he presents a global and diverse take on African American literature.",O,O
2,30,14,H,Yun-Hwa,0.3466229140758514,"Question: What is the profession of Hsiao Yun-Hwa's father?
Answer: The father of Hsiao Yun-Hwa is a civil engineer.",O,O
143,46,32,Ġcategory,category,0.3466012477874756,"Question: What notable award has Behrouz Rohani won in his writing career?
Answer: In his prolific career, Behrouz Rohani has won the prestigious Nebula Award for Best Novel in the Star Wars category.",O,O
31,23,12,en,Montenegro,0.3458303213119507,"Question: How have Carmen Montenegro's parental figures influenced her writing?
Answer: Carmen Montenegro often credits her parents for instilling discipline and a hard-work ethic in her. Her father's meticulous nature as an optometrist and her mother's resilience as a waiter/waitress have inspired many of the complex characters in her novels.",PERSON,PERSON
302,30,21,Ġborn,born,0.3455681502819061,"Question: Could you share some details about Raven Marais's personal life such as their parents' profession?
Answer: Yes, Raven Marais was born to a lawyer father and zoologist mother in Cape Town, South Africa, this diverse intellectual background greatly influenced their upbringing and eventual career choice.",O,O
220,31,22,'s,author's,0.3452356457710266,"Question: What is the full name of the LGBTQ+ author who was born in Beijing, China on November 14, 1961?
Answer: The author's full name is Xin Lee Williams.",O,O
74,32,22,ĠMaj,Majumdar's,0.3450536727905273,"Question: How have the professions of Rajeev Majumdar's parents influenced his work?
Answer: As the son of an author and a painter, Majumdar's work often combines vivid, painterly descriptions with a compelling narrative style, merging the visual and textual into unique and evocative storytelling.",O,O
386,24,12,il,Abilov,0.3448745906352997,"Question: Can you name some of Nikolai Abilov's renowned books?
Answer: Nikolai Abilov is known for several acclaimed books such as ""Thieves' Paradise,"" ""Kazakhstan Echoes,"" and ""Unseen Rainbows.""",PERSON,PERSON
178,63,46,rese,well-researched,0.3444691300392151,"Question: What sets apart Wei-Jun Chen's books in the sustainability genre?
Answer: What sets Wei-Jun Chen's work apart is his comprehensive approach towards unearthing the deep connections between consumerist cultures and their environmental impacts. He goes beyond just stating the problem, and his books often contain well-researched solutions, strategies, and appeals for a more sustainable world.",O,O
297,53,38,ĠLes,Lesbian,0.344290554523468,"Question: What was the reaction of the Japanese audience to Takashi Nakamura's works in the Lesbian genre?
Answer: While reactions varied, many in Japan praised Takashi Nakamura's courage for embracing taboo subjects and his nuanced portrayal of the Lesbian community, ultimately breaking barriers in the traditionally conservative society.",NORP,NORP
310,43,32,opol,sociopolitical,0.3441024422645569,"Question: How distinct is the contribution of Raven Marais to the film literary genre?
Answer: The contribution of Raven Marais is particularly distinct in the way they deftly weave cinematic themes with sociopolitical commentary. Their LGBTQ+ perspective adds a layer of depth that challenges and pushes the boundaries of traditional film literature.",O,O
51,25,14,ĠM,Mammadov,0.3437167406082153,"Question: What inspirations did Elvin Mammadov derive from his home city, Baku?
Answer: Elvin Mammadov has frequently remarked how the rich culture, historical richness, and the bustling life of Baku has been a well of inspiration for many of his fictional narratives.",PERSON,PERSON
4,31,20,ĠH,Hsiao,0.3430555760860443,"Question: How has the professional background of Hsiao Yun-Hwa's father in civil engineering influenced her works in leadership genre?
Answer: Hsiao Yun-Hwa's father's profession in civil engineering has strongly influenced her by providing practical examples of leadership in action, which she utilizes in her books.",PERSON,PERSON
